标题,室数,厅数,卫数,面积,朝向,建造时间,小区,行政区,街道,门牌号,单价,总价,楼层所属区域
精装修 电梯房 满二唯一住房 102平 南北通透 看房方便,2,2,1,102.22,南北,2019,丽水康城,硚口,古田,沿河大道438号,14675,150,高层
保利城精准小三房 186万 满五唯一 高视野 看房有钥匙,3,2,1,94.77,南,2016,保利城一期,洪山,铁机路,团结大道1049号,19627,186,中层
王家湾核心商圈 地铁口 一线看湖 前后无遮挡 老证,3,2,1,106.9,南北,2017,王家湾中央生活区,汉阳,王家湾,汉阳大道,15716,168,中层
汉桥城中花园 精装修三房两厅 拎包入住 钥匙在手 随时看房,3,2,1,90,南北,2018,汉桥城中花园D区,汉阳,七里庙,汉桥路,12778,115,高层
保利公园九里小三房，不临铁路不临高架，小区中间安静,3,2,1,94.23,南北,2011,保利公园九里(1-4期),洪山,新南湖,南湖小路9号,18360,173,中层
房源采光好，南北通透，业主诚意出,3,2,2,111.62,南北,2016,汉北大全景,黄陂,武湖,汉口北大道,8512,95,高层
武胜路地铁口 精装3房2厅2卫带阳台 满五 朝南 配套成熟,3,2,2,117.93,南,2003,江山如画(5期),硚口,崇仁路,江中路71号,23574,278,高层
