标题,室数,厅数,卫数,面积,朝向,建造时间,小区,行政区,街道,门牌号,单价,总价,楼层所属区域
东湖边 央企核心C位 天花板级别大盘   新房侨城欢乐天际,3,2,2,122,南北,2014,华侨城欢乐天际(新房),青山,余家头,团结大道地铁4号线工业四路站B出口（华侨城杉·艺术空间）,18443,225,高层
光谷主城区  地铁口  准现房,3,2,2,117.74,南北,2014,伟鹏硅谷小镇一期,洪山,光谷东,未来三路和科技三路交汇处,13420,158,高层
地铁口（保利新武昌旁） 满二  保利上城 南北通透,3,2,2,117.6,南北,2018,保利上城西区,洪山,白沙洲,峰胜路20号,16837,198,高层
洪山区102平 金地西岸故事 精装修 采光好 周边商圈成熟,3,2,1,102.19,南北,2011,金地西岸故事,洪山,珞狮南路,珞狮路254号,17125,175,低层
汉口火车站旁 福星城南区 满五   精装修 中高楼层 采光好,3,2,1,96.8,南北,2008,福星惠誉福星城(南区),江汉,汉口火车站,常青一路2号,17562,170,高层
捡漏地铁口带露台 单价8000电梯房 谁是可看,3,2,2,129.96,南北,2008,海景花园(C区),东西湖,吴家山,二雅路50号,8311,108,低层
南北通透 3室2厅 企业力荐好房诚意出售,3,2,2,124.65,南北,2020,招商一江璟城(北区),青山,红钢城,建设六路5号,19495,243,低层
130平 3室2厅 南北通透 虹顶家园 居家自住 保养好,3,2,2,130.16,南北,2003,虹顶家园,武昌,南湖花园,恒安路49号,19438,253,高层
