标题,室数,厅数,卫数,面积,朝向,建造时间,小区,行政区,街道,门牌号,单价,总价,楼层所属区域
超大阳台 全房明亮 开发商直降 性价比高,3,2,2,120,南北,2014,龙湖揽境,硚口,古田,长丰大道与古田二路交汇处,15000,180,高层
出门地铁口  老证 不临街 无遮挡 精装两房  中高楼层,2,2,1,82.93,南,2011,幸福时代(一二期),江岸,百步亭,后湖大道335号,16762,139,中层
首地老证过户， 边户南北双阳台，随时看房,3,2,2,145.29,南北,2019,首地云梦台,江岸,后湖,华岭路66号,16863,245,低层
沙湖必看好房 两室精装 国际城一期 中间楼层 随时看房,2,2,1,92.24,南,2001,福星惠誉国际城(1期),武昌,团结大道,徐东大街28号,23092,213,高层
3室2厅 南北通透 124平 电梯房 房东急置换 现228W,3,2,1,124.95,南北,2000,三阳广场,江岸,永清街,三阳路128-130号,19048,238,高层
万科西半岛精装修退台式洋房,3,2,2,135.01,南北,2007,万科四季花城西半岛,东西湖,金银湖,环湖路18号,9985,134.8,低层
电梯房 4室2厅 119平 广电兰亭盛荟(四期) 居家自住,4,2,2,119,东南,2021,广电兰亭盛荟(四期),汉阳,四新,四新大道163号,15547,185,中层
