标题,室数,厅数,卫数,面积,朝向,建造时间,小区,行政区,街道,门牌号,单价,总价,楼层所属区域
地铁口300米 满五唯1  急售 房东配合 自住装修,3,2,1,84.78,南,2016,平安光谷春天,江夏,金融港,高新六路15号,17457,148,低层
必看好房 错过拍大腿 保利拉菲 精装三开间朝南 满五唯一,3,2,1,92.21,南北,2012,保利拉菲,洪山,卓刀泉,楚康路301号,19738,182,低层
送!送!送!房东只拎衣服走，家电家具全部送！,3,2,1,95.7,南北,2013,招商雍华府,洪山,新南湖,文馨街5号,21944,210,低层
满五  无抵押 四房 一手房东  好楼层钥匙在手,4,2,2,142.09,南北,2012,保利华都,洪山,卓刀泉,虎泉街299号,28715,408,中层
满五   正南 3室2厅 精装修,3,2,1,92.96,南,2013,保利心语(九期),洪山,新南湖,野芷湖南路5号,16126,149.9,低层
欧洲风情小区，老证带车位，一线看湖，南北通透，业主急卖随时看,4,2,2,141.3,南,2019,招商公园1872(B3-2地块),汉阳,四新,凤举路,18401,260,中层
