标题,室数,厅数,卫数,面积,朝向,建造时间,小区,行政区,街道,门牌号,单价,总价,楼层所属区域
老证诚售  近洪山广场 地铁12号线旁 目送式教育 配套齐全,3,2,1,91.51,南北,2015,万科金色城市锦绣苑,洪山,白沙洲,白沙五路7号,15518,142,高层
智苑小区 必看好房 有证 可贷款可过户 价格狂甩周边几条街的,3,2,1,89.4,南,2018,智苑小区,洪山,光谷东,流港路100号,8502,76,低层
保利庭瑞阅江台滨江新品     3室2厅2卫 130m,3,2,2,130,南,2014,保利庭瑞阅江台·滨江新品,硚口,古田,琴台大道与玉龙路交汇处,20000,260,高层
满二唯一 正南 2室2厅 精装修,2,2,1,81.8,南,2015,黄陂人信城,黄陂,前川,前川街188号,9536,78,高层
小高层带电梯，中间楼层，低价处理，随时看房,4,2,2,148.29,南北,2008,美林青城,洪山,铁机路,纺机路20号,20771,308,中层
正南 4室2厅 企业力荐好房诚意出售,4,2,1,196.23,南,2008,中国院子,黄陂,盘龙城,盘龙大道特8号,15238,299,共1
